{
  "year": 1943,
  "draw_count": 52,
  "first_date": "1943-01-02",
  "last_date": "1943-12-25",
  "draws": [
    {
      "date": "1943-01-02",
      "contest": 1,
      "wheels": {
        "bari": [44, 76, 32, 69, 49],
        "cagliari": [85, 37, 23, 49, 38],
        "firenze": [85, 13, 82, 6, 74],
        "genova": [19, 64, 9, 43, 85],
        "milano": [6, 73, 37, 69, 70],
        "napoli": [69, 15, 5, 89, 2],
        "palermo": [11, 35, 85, 38, 41],
        "roma": [68, 50, 72, 63, 90],
        "torino": [56, 21, 8, 5, 41],
        "venezia": [22, 47, 9, 63, 88]
      }
    },
    {
      "date": "1943-01-09",
      "contest": 2,
      "wheels": {
        "bari": [30, 42, 1, 73, 62],
        "cagliari": [66, 42, 86, 2, 22],
        "firenze": [3, 39, 41, 48, 20],
        "genova": [50, 18, 53, 22, 11],
        "milano": [43, 39, 11, 8, 59],
        "napoli": [45, 39, 43, 28, 38],
        "palermo": [86, 89, 65, 77, 8],
        "roma": [8, 66, 59, 49, 4],
        "torino": [47, 48, 42, 64, 24],
        "venezia": [81, 68, 24, 7, 51]
      }
    },
    {
      "date": "1943-01-16",
      "contest": 3,
      "wheels": {
        "bari": [88, 90, 18, 84, 8],
        "cagliari": [16, 77, 66, 34, 7],
        "firenze": [74, 82, 41, 25, 81],
        "genova": [26, 85, 40, 39, 13],
        "milano": [22, 44, 63, 50, 72],
        "napoli": [1, 54, 85, 83, 40],
        "palermo": [66, 13, 22, 84, 60],
        "roma": [84, 46, 89, 4, 5],
        "torino": [70, 57, 56, 50, 81],
        "venezia": [83, 30, 85, 59, 44]
      }
    },
    {
      "date": "1943-01-23",
      "contest": 4,
      "wheels": {
        "bari": [40, 13, 37, 86, 72],
        "cagliari": [8, 81, 29, 12, 46],
        "firenze": [49, 75, 23, 83, 12],
        "genova": [72, 34, 46, 58, 43],
        "milano": [66, 65, 18, 68, 64],
        "napoli": [27, 3, 50, 38, 45],
        "palermo": [3, 48, 33, 18, 27],
        "roma": [88, 37, 52, 16, 47],
        "torino": [29, 40, 75, 37, 41],
        "venezia": [74, 50, 67, 54, 10]
      }
    },
    {
      "date": "1943-01-30",
      "contest": 5,
      "wheels": {
        "bari": [76, 3, 13, 66, 17],
        "cagliari": [13, 76, 64, 2, 7],
        "firenze": [58, 82, 65, 6, 47],
        "genova": [22, 78, 79, 42, 85],
        "milano": [23, 79, 24, 45, 8],
        "napoli": [89, 78, 72, 76, 67],
        "palermo": [34, 76, 67, 2, 11],
        "roma": [8, 84, 50, 11, 68],
        "torino": [88, 61, 22, 44, 59],
        "venezia": [45, 25, 47, 48, 13]
      }
    },
    {
      "date": "1943-02-06",
      "contest": 6,
      "wheels": {
        "bari": [50, 2, 79, 90, 81],
        "cagliari": [69, 8, 36, 21, 57],
        "firenze": [75, 35, 33, 87, 38],
        "genova": [71, 37, 5, 1, 55],
        "milano": [9, 25, 66, 52, 37],
        "napoli": [49, 87, 52, 36, 24],
        "palermo": [48, 81, 82, 32, 70],
        "roma": [17, 33, 61, 73, 65],
        "torino": [37, 27, 66, 6, 65],
        "venezia": [35, 83, 19, 21, 67]
      }
    },
    {
      "date": "1943-02-13",
      "contest": 7,
      "wheels": {
        "bari": [4, 88, 46, 16, 25],
        "cagliari": [80, 31, 2, 23, 7],
        "firenze": [58, 88, 56, 21, 82],
        "genova": [63, 52, 57, 6, 1],
        "milano": [52, 88, 25, 54, 1],
        "napoli": [62, 18, 57, 90, 37],
        "palermo": [80, 49, 63, 31, 7],
        "roma": [46, 81, 49, 69, 10],
        "torino": [87, 79, 9, 40, 13],
        "venezia": [67, 1, 84, 74, 78]
      }
    },
    {
      "date": "1943-02-20",
      "contest": 8,
      "wheels": {
        "bari": [36, 12, 22, 17, 80],
        "cagliari": [54, 30, 48, 80, 89],
        "firenze": [39, 75, 35, 73, 11],
        "genova": [67, 22, 70, 6, 16],
        "milano": [53, 71, 48, 68, 69],
        "napoli": [86, 78, 42, 24, 88],
        "palermo": [35, 22, 30, 44, 66],
        "roma": [10, 90, 36, 80, 2],
        "torino": [1, 70, 9, 48, 21],
        "venezia": [37, 56, 30, 81, 48]
      }
    },
    {
      "date": "1943-02-27",
      "contest": 9,
      "wheels": {
        "bari": [10, 54, 40, 27, 19],
        "cagliari": [9, 54, 12, 2, 38],
        "firenze": [62, 25, 79, 37, 53],
        "genova": [45, 28, 74, 14, 60],
        "milano": [34, 79, 88, 42, 14],
        "napoli": [53, 41, 1, 46, 15],
        "palermo": [74, 30, 3, 7, 49],
        "roma": [64, 74, 51, 84, 56],
        "torino": [50, 44, 24, 23, 68],
        "venezia": [77, 29, 33, 53, 5]
      }
    },
    {
      "date": "1943-03-06",
      "contest": 10,
      "wheels": {
        "bari": [12, 73, 83, 5, 66],
        "firenze": [79, 81, 28, 5, 77],
        "genova": [46, 69, 50, 73, 66],
        "milano": [30, 54, 38, 50, 44],
        "napoli": [35, 21, 88, 37, 71],
        "palermo": [54, 13, 46, 70, 59],
        "roma": [54, 68, 21, 1, 22],
        "torino": [41, 33, 28, 69, 68],
        "venezia": [16, 27, 25, 72, 49]
      }
    },
    {
      "date": "1943-03-13",
      "contest": 11,
      "wheels": {
        "bari": [89, 81, 10, 77, 21],
        "firenze": [4, 34, 32, 17, 64],
        "genova": [15, 70, 90, 33, 27],
        "milano": [24, 39, 85, 20, 32],
        "napoli": [66, 68, 6, 16, 39],
        "palermo": [32, 40, 7, 58, 52],
        "roma": [58, 82, 45, 72, 5],
        "torino": [80, 89, 82, 1, 44],
        "venezia": [7, 2, 8, 29, 38]
      }
    },
    {
      "date": "1943-03-20",
      "contest": 12,
      "wheels": {
        "bari": [64, 3, 62, 58, 63],
        "firenze": [59, 72, 75, 46, 40],
        "genova": [8, 73, 90, 84, 20],
        "milano": [21, 28, 67, 39, 34],
        "napoli": [48, 7, 6, 27, 47],
        "palermo": [77, 42, 59, 29, 3],
        "roma": [75, 24, 60, 29, 30],
        "torino": [63, 50, 3, 68, 62],
        "venezia": [67, 80, 50, 2, 27]
      }
    },
    {
      "date": "1943-03-27",
      "contest": 13,
      "wheels": {
        "bari": [7, 26, 1, 54, 24],
        "firenze": [39, 48, 56, 1, 80],
        "genova": [22, 58, 60, 26, 12],
        "milano": [28, 36, 11, 82, 26],
        "napoli": [47, 83, 19, 63, 80],
        "palermo": [26, 14, 50, 15, 71],
        "roma": [78, 71, 33, 44, 8],
        "torino": [82, 80, 50, 10, 15],
        "venezia": [55, 4, 29, 6, 13]
      }
    },
    {
      "date": "1943-04-03",
      "contest": 14,
      "wheels": {
        "bari": [50, 29, 3, 63, 13],
        "firenze": [7, 71, 43, 5, 76],
        "genova": [87, 4, 80, 28, 53],
        "milano": [89, 19, 50, 75, 90],
        "napoli": [67, 71, 3, 27, 68],
        "palermo": [18, 69, 60, 79, 46],
        "roma": [80, 24, 49, 10, 42],
        "torino": [30, 80, 12, 81, 31],
        "venezia": [82, 83, 58, 36, 39]
      }
    },
    {
      "date": "1943-04-10",
      "contest": 15,
      "wheels": {
        "bari": [75, 14, 48, 9, 68],
        "firenze": [52, 78, 8, 7, 73],
        "genova": [27, 41, 32, 64, 84],
        "milano": [75, 30, 83, 84, 57],
        "napoli": [75, 49, 62, 34, 29],
        "palermo": [46, 30, 76, 58, 35],
        "roma": [11, 86, 73, 79, 16],
        "torino": [49, 1, 61, 24, 68],
        "venezia": [86, 55, 33, 66, 17]
      }
    },
    {
      "date": "1943-04-17",
      "contest": 16,
      "wheels": {
        "bari": [78, 10, 16, 20, 32],
        "firenze": [26, 27, 11, 69, 84],
        "genova": [67, 81, 13, 51, 40],
        "milano": [38, 27, 26, 17, 7],
        "napoli": [62, 6, 72, 63, 85],
        "roma": [71, 9, 37, 18, 83],
        "torino": [21, 47, 45, 85, 88],
        "venezia": [60, 34, 90, 6, 70]
      }
    },
    {
      "date": "1943-04-24",
      "contest": 17,
      "wheels": {
        "bari": [53, 54, 31, 59, 81],
        "firenze": [65, 20, 88, 87, 42],
        "genova": [51, 39, 45, 16, 1],
        "milano": [62, 76, 3, 37, 2],
        "napoli": [28, 8, 45, 46, 77],
        "roma": [6, 88, 49, 52, 82],
        "torino": [31, 14, 23, 80, 72],
        "venezia": [15, 20, 87, 57, 13]
      }
    },
    {
      "date": "1943-05-01",
      "contest": 18,
      "wheels": {
        "bari": [68, 33, 1, 35, 9],
        "cagliari": [83, 17, 47, 74, 37],
        "firenze": [22, 19, 80, 42, 31],
        "genova": [35, 70, 29, 60, 88],
        "milano": [86, 65, 52, 14, 45],
        "napoli": [41, 79, 24, 38, 39],
        "roma": [84, 11, 62, 20, 75],
        "torino": [36, 25, 85, 81, 10],
        "venezia": [64, 58, 37, 70, 47]
      }
    },
    {
      "date": "1943-05-08",
      "contest": 19,
      "wheels": {
        "bari": [48, 16, 53, 58, 59],
        "cagliari": [77, 29, 1, 18, 16],
        "firenze": [44, 77, 55, 41, 27],
        "genova": [57, 30, 52, 84, 80],
        "milano": [59, 52, 30, 21, 62],
        "napoli": [13, 28, 44, 32, 26],
        "roma": [60, 5, 71, 69, 2],
        "torino": [74, 59, 33, 18, 40],
        "venezia": [8, 79, 60, 73, 28]
      }
    },
    {
      "date": "1943-05-15",
      "contest": 20,
      "wheels": {
        "bari": [36, 4, 63, 90, 50],
        "cagliari": [27, 29, 15, 1, 37],
        "firenze": [18, 32, 25, 53, 90],
        "genova": [14, 21, 30, 58, 19],
        "milano": [26, 68, 32, 24, 79],
        "napoli": [26, 67, 63, 85, 17],
        "roma": [44, 49, 43, 8, 41],
        "torino": [22, 1, 43, 48, 35],
        "venezia": [76, 56, 11, 63, 28]
      }
    },
    {
      "date": "1943-05-22",
      "contest": 21,
      "wheels": {
        "bari": [52, 46, 15, 4, 14],
        "firenze": [11, 54, 77, 7, 18],
        "genova": [16, 88, 54, 34, 80],
        "milano": [67, 26, 50, 21, 12],
        "napoli": [58, 34, 74, 21, 80],
        "roma": [72, 79, 21, 52, 7],
        "torino": [50, 17, 41, 66, 64],
        "venezia": [52, 79, 89, 58, 12]
      }
    },
    {
      "date": "1943-05-29",
      "contest": 22,
      "wheels": {
        "bari": [71, 45, 88, 1, 16],
        "firenze": [33, 74, 48, 64, 80],
        "genova": [77, 43, 47, 85, 74],
        "milano": [88, 1, 21, 49, 60],
        "napoli": [31, 67, 17, 46, 35],
        "roma": [48, 44, 38, 85, 70],
        "torino": [44, 66, 39, 6, 62],